user,time,score,comment
_mbc42****3364369,2019/10/5,5,值得一游………………………………
M59****834,2019/10/5,5,十一去的、人很多、本来想着要深度了解一下孔老夫子的一生、可是带着讲解器也因为外界环境的闹腾听的不详细了，在这里说一下总体感觉吧、这地适合人少一些来、最主要租的这个讲解器、三个地都可以还、但是出口是给人打电话联系、并没有指定地点去还的
138****7856,2019/10/5,5,带着孩子去的，了解历史文化，导游也很负责。
曲阜三孔,2019/10/5,1分 不佳,很差，说话太慢，走过几个，第一个都还没有说完。讲解内容太少，景区有电子的
曲阜三孔,2019/10/5,1分 不佳,太简单了不值，就那么几处简单的古景
曲阜三孔,2019/10/5,2分 一般,最伤心的一次旅行给小偷贡献了三百多
曲阜三孔,2019/10/5,2分 一般,管理混乱，价格虚高。孔庙还可以看看，其他两个景点不值，联票不划算。
曲阜三孔,2019/10/5,1分 不佳,不能按照景点自动播放也就算了，居然经常莫名其妙的停，停了需要点暂停再点开始，平均不到1分钟停一次！！！！！
三孔景区,2019/10/5,4,"如今三孔联票降价了，网上购票之后只需刷身份证就可以入园，非常方便。推荐最好租一个讲解，不然全是古殿、古碑、古墓、古树的，看不出个所以然，而这些都是蕴含文化底蕴的，每一处都有它特有的历史故事。
孔庙孔府仅一墙之隔，很近。孔林距离这辆处1.5千米，走过去比较远，有三种交通工具可供选择：大巴车、人力三轮车、马车。其中人力三轮车最便宜，五块一人，一车坐两人。马车是可以体验的一个项目，十块一人。
                            
	                            
		                            "
三孔景区,2019/10/5,4,"文化之旅，感受儒家文化。孔庙门票80，孔府60，孔林10，有联票加上来往接驳交通179/人。只去了孔庙和孔府，没去孔林不知道远近，要是去这两个地方真心不需要交通，从附近停车场走过去很近，或者做三轮车也很便宜。周围停车一次20―30不等。最好有导游，一个景点100，也可以用电子讲解器50/个，微信讲解是30，待了两天，票和讲解器都是可以用的。
                            
	                            
		                            "
三孔景区,2019/10/5,4,"孔府孔庙位置在一起，孔林要往北两公里，售票放弃不是特别好，140包含三孔，孔府孔庙两处也是140。为毛线啊。
参观孔庙非常多古树很奇特。
孔府格局比较丰富，小巷比较多，特别窄。后侧花园不知道是不是这个季节问题，感觉很旧，整体感觉也都是旧旧的。周边的饮食没法看，不知道当地是怎么想的，只能赤裸裸的来个差评
                            
	                            
		                            "
_WeCh****432834,2019/10/4,4,60岁以上，1.4以下儿童都免费，符合儒家文化的特点，比起国内和你多景点都讲良心。点赞以后有机会再来观光，这次感受不错
203****250,2019/10/4,5,值得一看！还不错！对任何事都很挑剔的闺女，给了这样的评价！！！
依水寒石,2019/10/4,5,曲阜三孔景区确实值得一去，尤其对孩子有很大的教育意义。携程订票很方便，还优惠了10元。到景区直接刷身份证即可入园。
M36****0693,2019/10/4,5,景点很好，可惜时间紧张，下次再来一定多带一些人，多玩几天好好感受一下。
彼得罗扎沃茨克廖化,2019/10/4,4,排除节日景区饱和量因素之外，景区历史氛围还是很浓厚的，尤其大成殿的龙柱，好像印象中很少见到。值得一去。
_WeCh****69745,2019/10/4,5,很好之前很多次路过都没进去&#x20;这次进来玩的很开心
M24****476,2019/10/4,5,声音清晰，定位准确，使用方便，价格合适
M20****891,2019/10/4,5,古迹完整，文化底蕴深厚，适合慢慢游。十一哪都是人，影响心情，建议错峰游。
M36****2247,2019/10/4,4,三个景点，只有孔庙5A的，历史底蕴深厚，蛮正规的，乱卖东西的也很少，能深刻感受到千年文化沉淀。孔府商业化太严重了，随便逛一下都是商店。孔林一开始很多路边“导游”，不建议选择，因为她带你去的景点讲解自己也能看到，可以坐个观光车20元&#x2F;人，带你逛遍孔林。最推荐的还是孔庙。
佐辛巴,2019/10/4,4,属于传统文化之旅，纯游玩的话可能不是太有娱乐性，可以了解历史了解儒家文化。
M25****2368,2019/10/4,5,一般一般一般一般一般一般一般一般
willyuan2920,2019/10/4,4,商业化太浓重，文化遗产保护不够
139****9827,2019/10/4,5,已经来过两次了。真的挺好。以后还会过来。感受孔子的文化。点赞
深蓝的记忆,2019/10/4,5,至圣故里，山东必去景点。在这里感受好客山东的热情，景区明码标价，还有免费停车位提供大家使用，景区无任何乱收费现象
M32****3272,2019/10/4,5,人数多！国庆节人多，饭菜质量不好
118****434,2019/10/4,5,有孔庙，孔府和龙林。前两个推荐去看，后一个是孔氏的族坟，不感兴趣的可以略去了
136****2660,2019/10/4,4,淡季去的，人也不少，有学校组织学生统一参观，没有必要单独请导游，里面有有多导游在给游客讲解，凑近听听就可以。
大豆雀儿,2019/10/4,5,方便挺好的，啊啊******************************哦哦
M36****0511,2019/10/4,5,非常好的一次旅行，带着孩子去的，古城古巷很有地方特色，有机会还会带着孩子一起来
206****937,2019/10/4,5,十一人太多了，半天游完三孔，找个导游给孩子介绍一下，还是能学到很多的。
M28****1725,2019/10/4,5,挺好的，一次旅行，以后还会再携程买的
smartsprit,2019/10/4,5,不用换票非常方便。早晨的开门仪式很精彩。孔庙孔府感觉很一般。室内的展厅大多不开放，非常黑，看不清。
M29****8226,2019/10/4,5,过年期间订单了，8点钟开门典礼一定要看，可以租一个讲解器。孔林的话还是要买一张浏览车票的。儒家风气很浓郁
小雪儿呵,2019/10/4,5,曲阜三孔景区很好，不过导游的素质有待提高，普通话很不标准，有点受骗的感觉，体验感不好。
revlised,2019/10/4,4,国庆长假期间人真的是太多了。曲阜三孔说实话没有什么太大的看点，景区内商业化气息太浓，到处是野导游和卖各种纪念品的地方，好好的大殿全部成了卖商品的
M35****8026,2019/10/4,4,其他都挺好，就是讲解器跑了好几个地方才退掉
做一个正能量的妈妈,2019/10/4,5,还不错，孩子路上一直在听，而且还有多个选择
M30****211,2019/10/4,4,还行吧。曲阜整体旅游环境还是不错的，环境好，酒店环境都不错，就是的士比较少，这点不如泰安。3孔没去还是值得一游。
M31****3439,2019/10/4,4,管理的太混乱，门口那家饭店实在太难吃惹
M36****2521,2019/10/4,5,很有教育意义，值得带孩子参观。
M24****1513,2019/10/4,5,用携程买票又方便又便宜&#x20;下次再用
M36****4909,2019/10/4,5,整体不错，建议提前规划好路线！！
M36****0680,2019/10/4,5,挺好玩的，十月一带着老婆孩子出来转转。
M22****1157,2019/10/4,5,如果有时间建议分一天半游玩，三孔建筑物多，一天玩的话会很累。景区里有专业的导购，会讲解景点的来历和一些趣闻，个人觉得比自动的景区讲解机器好些，讲解机器虽然严谨，但是导游会讲解一些讲解机里没有的东西，各有利弊吧。去孔庙游玩，可能一块碑文都有讲究，总体玩得很开心。孔庙早晚有开关城门仪式，很震撼，正常开城门在8点，关城门在5点，不过节假日想去的朋友们可以提前问一下时间，我十一去的三孔，为了方便游客游园，开城门提前了半个小时。仅供参考。
BOB_TIAN,2019/10/4,5,门票有点贵，景点也没啥特点，但景区卖的东西，吃的东西都很便宜，商贩很实诚。
M31****9046,2019/10/4,5,人太多啦，都走不动，人挤人的！
M32****4900,2019/10/4,5,购买曲阜三孔景点联票很划算，超赞！！！
M36****8127,2019/10/4,5,三孔的原生态真美，旅客很多，志愿者很热情，介绍详细，服务态度很好，下次再去旅游。
M24****4434,2019/10/4,4,景点很好，千万别雇佣导游就行，实在太无良了，在孔庙里面忽悠我们买画刻印章，然后在孔府简单说了两句就把我们直接带到后花园，好几个地方都没去。
麦子,2019/10/4,5,老远开车过来，真的值得一看，值得一看。
M25****3008,2019/10/4,5,人多啊，到处看人排队，不过很能感受孔子的文化气息。
M12****07,2019/10/4,5,带着孩子一起感受一下儒家思想文化！给我印象深刻的是孔庙！里面的碑文超多故事也是最多的！有时间的话下次还会再去！
三毛爱旅行,2019/10/4,5,游玩这种人文历史性的地方，需要请个导游的。长姿势不少
曲阜三孔,2019/10/4,2分 一般,奔着神圣的心情前往，结果有些失望，孔庙里面三个大殿被开发成了卖东西的场所，孔府和孔林也是商业气息太重。本是中华民族对外的一个名片，结果被硬生生做成了买卖，遗憾，失望。另外，三孔周边停车极其不方便，终于找到一家，还是强制性收取50元每次，且态度极为恶劣，不提供任何票据。倘若孔老夫子知道后人的行为，又是如何感想。
曲阜三孔,2019/10/4,1分 不佳,没什么玩的，去一次就不愿意再去了
曲阜三孔,2019/10/4,1分 不佳,什么都没有只有树，没什么好玩的。
曲阜三孔,2019/10/4,1分 不佳,太差了，太假了，太差了，太假了，太差了，太假了
曲阜三孔,2019/10/4,1分 不佳,由于时间仓促没来的急慢慢观看，这边外面**的服务很不好，欺骗外客就算了，拉个客户，同一个地方，他们能说出不同的公里数，几个价位，好的映像都被他们搅黄了！孔子这么神圣的地方，我们都是怀着崇高的敬意来的，曲阜怎么就出了这样的人才。个人建议想发财不是靠着几天，别把面子失了。
三孔景区,2019/10/4,4,"十一期间到济南旅游，想带着孩子到孔圣人的故乡看一看，于是驱车来到曲阜，孔府孔庙孔林三个地方的联票140，加上三个景区的直通车票是170，1米4以下小朋友只需要买车票，不用买门票，听导游讲讲还是不错的，就是人太多了
                            
	                            
		                            "
M27****4550,2019/10/3,4,解说不错，价格实惠，就是音频不稳定，经常无法结束上一个音频下一个就同时放，被迫多次退出app重新登录才能解决
139****8668,2019/10/3,5,国庆节出游，人真的好多，预计4个小时完完的，可能是带着老人小孩的关系，完了一下午。建议一定要听解说，效果不一样。
M50****122,2019/10/3,5,人太多了，提前订票很方便！没便宜多少钱！但是提醒诸位，千万别定景区大巴，30一个人，超级坑！停车场离景区很近！
118****004,2019/10/3,5,去了孔府和孔庙，景区很人性化，一路都有无障碍通道，也让我们推婴儿车出远门的很是省力。另外就是要感叹国学的造诣实在太深！
M29****5612,2019/10/3,5,非常好，适合全家旅游！是我们都值得学习和教育的地方！尤其对孩子！
205****565,2019/10/3,4,三孔景区具有非常深的文化底蕴，景区的管理还有待提升！导游和旅游短驳比较混乱，商业开发业态比较简单。总体还不错！
M43****794,2019/10/3,5,感受儒家文化，很棒。如果可以背下来三字经，可以免门票！
E14****01,2019/10/3,5,历史文化底蕴丰富，值得国人学习，传承优秀思想。
M23****081,2019/10/3,5,景点很好，十十期间人很多，值得推荐。
M48****957,2019/10/3,5,值得一去，环境好，进门可租解说器，经济实惠。
300****718,2019/10/3,4,我根本没预定过三孔门票。同时很多历史订票感到不对。有损我信誉，请网主取消。恢复我诚信。我怀疑我的网被盗用。请携程网重视。
M36****5257,2019/10/3,5,不错，感受儒家思想，不虚此行！有机会还会再来
E01****37,2019/10/3,5,不错。谢谢。景区很不错。下次再来。
海贝堡,2019/10/3,5,总体景点不错，就是孔林太远太大，得座观光车，没什么好看的景点，孩子太小的话兴趣不大。总体感觉挺好，不错。
136****8368,2019/10/3,5,不错，很不错哦，工作人员的责任很好
M29****5083,2019/10/3,5,酒店位置非常不错，离孔府和孔林都800米左右，门口就有买礼品的，方便
139****9957,2019/10/3,5,很方便，网上买票可以直接刷身份证进园，三个园都可以，省去了排队买票的时间。而且孔庙售票处离入口还很远，买电子票真心方便，推荐
M22****5329,2019/10/3,5,人真的是太多太多太多太多太多了！全是人从众人从众人从众人从众！
M22****9774,2019/10/3,5,带着老爸老妈，游玩的很好，即增进了家人的感情，又让我们留下了一个美好的回忆。孔府孔林孔庙都很值得去逛，只是最后那个庙，还是坐车进去比较舒坦。另外，给小马车一个赞，师傅就跟导游似的，给我们讲解，很详细，很到位。
_WeCh****527755,2019/10/3,4,建筑风格就是小一号的故宫，先要去孔庙，孔府在孔庙一起，孔林有10万的坟，所以还是坐车好，坟头有啥看的，孔庙门口吃的煎饼，加鸡蛋6块，老板看人要价，价格不贵，早餐吃的羊肉粥油条好便宜，接触曲阜人还是挺不错的。
M48****160,2019/10/3,5,带孩子去的，请了导游讲解很好。孩子不错的体验
张家小哥123,2019/10/3,4,作为本地人，感觉三孔还是不错的。不过需要有人讲解，
M59****918,2019/10/3,5,好值得游玩，收获丰富！！！！！！！
139****9659,2019/10/3,5,值得游览&#x20;感受文化&#x20;了解孔子&#x20;赞
可爱悠悠,2019/10/3,5,应该给10星的大好评&#x20;有幸由刘安平老师带队&#x20;与其自称讲者&#x20;不如尊为讲师&#x20;乐讲&#x20;会讲&#x20;用通俗易懂的语言&#x20;喜闻乐见的形式进行讲解&#x20;使历史生动。感谢如此用心的导游&#x20;临行还赠送了小礼物~~~9也祝安平老师&#x20;一生平安----孔氏77代传人
M29****9054,2019/10/3,5,很好不错，服务不错************************************************
鲁A驭龙,2019/10/3,5,票价没便宜多少，景点不错，值得一玩。
M25****5395,2019/10/3,5,给我印象最深的就是这块牌子，寓意深长，深刻地阐明了一个道理，那就是一个人要讲德行，有德行的人必会受到大家的拥护和青睐。
M42****451,2019/10/3,5,玩的很开心，人文休养圣地。带小孩学习孔圣人教育方式。
M23****6662,2019/10/3,5,文化气息很浓，很大。如果要慢慢品味，了解它的丰富内涵需要一天的时间来学习。提个小建议，一些不常见的繁体字和篆书还需要有个小提示！非常棒的，值得一去的地方！
M22****517,2019/10/3,5,讲解很到位，了解了历史，方便直接
嘟嘟小马,2019/10/3,4,携程购票真方便，景点门口买，刷身份证就可以直接进入，不用换票。
pho****come,2019/10/3,5,很值得一去&#x20;但是要避开高峰期哈
M24****7486,2019/10/3,5,讲解通俗易懂，走到一处听一处，印象很深刻
曲阜三孔,2019/10/3,2分 一般,景区4G信号好差，携程验票码打不开，不知是携程的问题还是景区问题
曲阜三孔,2019/10/3,2分 一般,什么都没有，不建议来。票价完全不值！
曲阜三孔,2019/10/3,1分 不佳,管理不好，太乱，太吵，老古物少了很多。只是破烂房太失望了！
曲阜三孔,2019/10/3,1分 不佳,人很多，秩序很乱，全是商业氛围，没有游玩兴趣，绝不会再去第二次
曲阜三孔,2019/10/3,1分 不佳,就孔庙还可以，其他的坑爹******
曲阜三孔,2019/10/3,1分 不佳,景区管理混乱，游客体验极差 租用的导览器居然只能远处归还退押金。
三孔景区,2019/10/3,5,"故地重游，
感受人山人海的国庆人气，
还是钟情孔庙的各种树，
各种碑，
儒家底蕴发源之地，
孔氏家族兴衰之始，
孔家故事多……
真是应了石碑上那句：
四海之内皆兄弟，
景区内有电子导游，
还有微信导游，
选择了微信导游很不错，
30元听完三孔。
                            
	                            
		                            "
三孔景区,2019/10/3,4,"到了曲阜，一定是三孔景区啦，门票150元，门口告示：山东身份证免票，。顺序先是孔府，再是孔庙，最后是孔林。排队进去，安检也很快。
由于我们是自由行，进去运气好，立马碰见一个福建人的团队，跟在旅游团队后面听着导游讲解，哈哈，美滋滋的，。
孔府很大气，也很豪华，据说也是后面修缮过的。一路过去到孔庙，进入大殿，有一股威严的感觉，据说，孔子的家规家教很严厉。到孔林是坐马车去的，30元一个人，直接送到孔林，进入景区再花20元坐电瓶车，在孔林里兜一圈，到达墓碑。
在孔府附近的小商品街有各种不同的曲阜特产，还有春秋战国时期的各种乐器，很好玩的，
参观整个过程要2个小时左右，有文化渊源的故事，有机会会再去曲阜的，这座安静，悠闲，又感觉有些老气的城市，
                            
	                            
		                            "
三孔景区,2019/10/3,4,"十一去的，人超级多，不过还好景区比较大，所以没有造成拥堵，景区有微信小程序讲解，个人感觉比租机器或者找导游好很多，三孔微信讲解是30元，可以无限循环听，景区外有个五马祠街，可以找到一些吃的，价格也不贵。
                            
	                            
		                            "
老狒狒的梦里水乡,2019/10/2,5,十一期间人超级多，三孔景区人挤人，孔庙是木质建筑群，留下了历朝历代的很多皇帝的痕迹，孔林里面很大，座了电瓶车，以为车上有讲解，其实啥也没有，就转了一圈而已
M24****595,2019/10/2,5,景点值得一看，毕竟有如此深厚的人文和历史底蕴。但是五一出游，景区附近的吃饭真成问题。带了老人不想跑，找了当地人带路，带了一圈回头了，只有套餐，没有单点的，非常坑。
大唐草民,2019/10/2,5,一个充满故事的地方，文化遍布每一个角落，每一个笔画的变化都会暗藏玄机，唯一的遗憾就是十一期间人太多了
68****821,2019/10/2,5,很有文化底蕴的旅游景点，棒棒的
M35****4904,2019/10/2,4,文化底蕴深厚，有导游讲解才能得其精髓。
m28****6888,2019/10/2,4,旅游专线一票到底&#x20;&#x20;最好提前做好功课去&#x20;&#x20;&#x20;不然不论现场导游和自助导游在那么吵杂的环境也听不好
M26****0725,2019/10/2,5,很好，是我们的最愉快的一次旅游。
M25****4903,2019/10/2,5,挺好的，一共三个景点，就是人太多了。挺好的，一共三个景点，就是人太多了。挺好的，一共三个景点，就是人太多了。挺好的，一共三个景点，就是人太多了
_m18****8002,2019/10/2,5,是一次愉快的有内涵的孔庙孔府之旅。细节决定。
138****8822,2019/10/2,5,环境优美，感受很深，非常棒！！！
燕菲闽,2019/10/2,5,我想要门票，哪里拿啊！求告知。
158****0163,2019/10/2,4,还不错。三孔依旧，这是第四次来曲阜乐。
黄舰明先生,2019/10/2,5,下午紧凑充实的曲阜三孔游！然后当晚赶至泰山脚下夜爬泰山！夜十点三刻开爬至南天门凌晨4点一刻！再花一个钟头至五点一刻到玉皇顶正好赶上看日出！
m27****65,2019/10/2,5,好，值得大家一游。强烈推荐！！！
cnzhou01,2019/10/2,5,还是方便，可以考虑考虑啊啊啊啊
M34****6574,2019/10/2,5,感受圣贤文化，传承中国古老文明，探寻圣贤足迹，肃然起敬
M36****2088,2019/10/2,5,呜呜**************************作用
_WeCh****305299,2019/10/2,5,很好！高上大的酒店，干净卫生，服务员态度很好！！！离景区超级近！！！周边配套完整！！！装修很豪华！！！
阜新正能亮,2019/10/2,5,三孔是山东有文化和历史的景点之一
曲阜三孔,2019/10/2,2分 一般,商业化太浓、变着花样让客户花钱、连环套路，希望能对所有客户以诚相待，将心比心！旅途本来就很劳累，让游客多一份舒心
曲阜三孔,2019/10/2,1分 不佳,破地方，永远不想再来，乱收费不说，出了事根本没人管，真是玷污了孔圣人的门风！
曲阜三孔,2019/10/2,1分 不佳,携程买票还没有**高，没劲！！
M35****739,2019/10/1,5,门票太贵，故宫才60元，哎，为了孩子，孔老夫子是值得我们学习一辈子的
oneononeon,2019/10/1,5,不愧是圣人，值得尊敬，值得学习，传承文化，传承国粹
M19****977,2019/10/1,5,非常方便。不用排队购票，进门刷身份证就好，简直高兴的不得了，老公说我这么做节省了不少时间。提前订好票，直接进入，不用排队，棒棒的！
M36****6939,2019/10/1,5,经济实惠，货真价实，方便快捷。
其实快乐很简单,2019/10/1,5,网上购票，直接刷身份证进门，相当方便
辣椒,2019/10/1,5,还是可以的，人力车也是很方便，挺便宜的。景点也值得一看。
M23****3994,2019/10/1,5,文化气息不错&#x20;碑文也不少&#x20;可以在了解历史文化同时，了解学习书法
206****672,2019/10/1,5,提前了解，现场购票有点乱，网上购票快！网上如果有儿童票就好了
曲阜三孔,2019/10/1,1分 不佳,门票价格贵的要命，而且里面没有任何特色，借孔子的名卖钱，污了孔圣人
三孔景区,2019/10/1,3,"联票140说实话有点贵了，好在因为背论语免票了…
三孔真的只推荐孔庙啊，买个电子讲解，不过里面游客很多，跟着蹭导游也可以，会讲很多电子导游不说的东西。孔庙大概逛了两小时吧
孔府真的啥也没有啊…就几间房一个后花园
最后因为太热了孔林也没去，就是个墓地…
还是想说票价贵了，只推荐孔庙
                            
	                            
		                            "
zhenglibo,2019/9/30,5,网上订票进园方便，三个人只需要一个二维码，很方便
shan****inhu,2019/9/30,5,东方圣城，儒学第一城，值得一去。
118****266,2019/9/30,4,不错的景点&#x20;值得一游，不愧为中国独一家
老铁大数据,2019/9/30,5,孔子文化，中华核心文化！孔子文化，中华核心文化！孔子文化，中华核心文化！
286****007,2019/9/30,5,一直以来都想来的地方，终于如愿以偿了，朝拜圣人，感受圣人的教诲。孔林很大，只拜了圣人及其儿子和孙子。
M24****1440,2019/9/30,4,说起来孔林应该是最不值得去的一个，可我偏偏孔林感受最深，就是因为孔林请了个导游20块钱，另外两个因为时间关系走马光花匆匆逛逛，再说这边导游要100一个景点所以就没请。着重说一下开城仪式，其实我们到的挺早了，在旁边吃了个早饭（真心不咋的，不过也没什么人在哪里吃）吃完出来就看不到表演了，人一下子就都冒出来了门口场地不大也没有台阶里面围一圈，剩下的人就只能在外面听了，总体感觉不是太好
_WB2****1346,2019/9/30,5,曲阜打卡地――孔林、孔庙、孔府，顺序游览，值得！
