user,time,score,comment
三孔景区,2020/6/24,5,"来曲阜游玩，三孔景区是必须要去的。
曲阜市的孔府、孔庙、孔林，统称曲阜“三孔”，是中国历代纪念孔子之地。
孔庙、孔林、孔府是《世界遗产》。
孔庙，包括三殿、一阁、一坛、三祠、两庑、两堂、两斋、十七亭与五十四门坊，气势宏伟、巨碑林立。
孔府，是孔子嫡系子孙居住之地，与孔庙毗邻，旧称“衍圣公府”。
孔林是孔子及其家族的专用墓地。
                            
	                            
		                            "
紫金王守仁,2020/6/23,5,曲阜当然是值得去的，时间不要太赶，还能顺便拐趟泰安。电子讲解没必要买，门口的60元讲解机和携程里3元讲解都没必要。人工讲解自然更不需要。。那是一个置身其中就能受益无数的地方，就算真的想了解，那就买三元的吧，能对一些无关紧要的典故有些皮毛的了解。
yoemiere,2020/6/23,5,还是很不错的，有助于了解中国儒家文化和孔子家族的历史。不好的体验是景区内缠着你的“导游”太多，有些烦人!
就是想和你呀,2020/6/23,5,值得推荐值得推荐??
M36****025,2020/6/22,4,你值得拥有
163****276,2020/6/22,5,体验很好，景色不错，有趣好玩，值得推荐，
M51****959,2020/6/22,5,曲阜人人是导游吗？一直跟着你，很烦人的
褪色的衬衫,2020/6/22,5,值得推荐，体验很好，有趣好玩，景色不错，
三孔景区,2020/6/21,5,"交通：
我们是住在附近的酒店步行就到了很方便，三孔离得比较远，需要做那个大巴车。大巴车会带着你。
我们找了一个导游，一路上给我们讲了许多关于三孔的故事，很有意思。我们买的通票也比较方便，去曲阜必去的地方。
                            
	                            
		                            "
allen,2020/6/20,5,有文化背景，很不错值得推荐，
M47****374,2020/6/20,5,服务超级赞，一下午讲解的非常清楚，人也很耐心，服务态度特别好，实名推荐??????，还会拍照、拍出来的超级好看。
曲阜三孔,2020/6/20,1分 不佳,曲阜圣人之乡，高中时来过一次，每每想起孔庙的神圣庄严总是想要再来朝拜一下。三孔依然没变，这点没什么好说的。 给一分的原因是作为旅游城市，景点周围拉客的黄包车夫扰客之执着堪称全国前三。。明明很客气地跟他们说了n遍，不坐车不坐车不坐车，结果还是被跟在后面反复要求乘坐！去过那么多城市，真的从来没见过这样执着扰客的。让他赶紧闪开，人家说我不文明不礼貌？！怎么着？！扰客可以，让你闪开就不礼貌？！圣人故里怎么不好好管理下这些人？失望至极
胡南e网情深,2020/6/19,5,景色不错，值得推荐，
三孔景区,2020/6/19,5,绝对值得一去，山东文化的代表胜地！
三孔景区,2020/6/19,5,"曲阜还是到游山东必到的地方啊！因为孔圣人。作为中国人，儒家思想和文化还是应该传承的，这里好像在某一年背诵论语是可以免票的，不过感觉很难哦！孔府孔庙孔林，三孔还是值得来的，好多学校组织游学，感觉学生们都很认真学习三孔的内涵，，老师们认真负责地给同学讲解。
                            
	                            
		                            "
M27****0103,2020/6/18,5,值得去看一看
嘻嘻哈哈312,2020/6/18,5,曲阜三孔，是世界文化遗产，孔子的思想影响了多少代人，儒家文化国中瑰宝。孔府隔壁有个子曰漫居酒店，感觉挺不错，房间也很新，应该是去年新装修的，也是属于儒家文化主题类的酒店，来曲阜的朋友可以去体验一下。
沐子今,2020/6/18,4,景色不错，和家里人一起去的，自驾吖，也还是挺方便的，也没停车位也没有很紧张，家里长辈可能更喜欢这类景点，喜欢历史的应该也会感兴趣，纯粹跟着晃悠去了，回廊遍拍照还是很好看的，
186****8289,2020/6/17,5,体验很好，景色不错，
139****3952,2020/6/17,4,早饭后我们去参观曲阜“三孔”。从停车场出来，就被旅游三轮车夫盯上兜售，且步步为营、死缠烂打，就入乡随俗吧。&#x0A;来到曲阜必看“三孔”，孔府、孔庙、孔林，是中国历代纪念孔子、推崇儒学的象征。它以丰厚的文化积淀、悠久历史、宏大规模、丰富文物珍藏以及科学艺术价值而著称。&#x0A;在这位自称孔家76代后人的孔兄关于“早不看庙，晚不看林”的明确指示下，我们不得不改变计划先去孔林。&#x0A;孔林，孔子家的家族墓地，是世界上延时最久、面积最大的氏族墓地。在此，我们拜谒了这位东方思维方式的伟大奠基者。&#x0A;随后，我们依次游览了孔府和孔庙。孔府，孔子嫡系后裔的家，是中国现存最大最豪华的贵族庄园；孔庙，祭祀孔子的庙宇，它的规模和建筑规格与中国帝王建筑等同。??景色不错，值得推荐，&#x0A;孔兄一路骑行一路介绍，肚子里还有不少儒家历史和文化，我们坐着三轮车也省力。他事先曾表态游完“三孔”再收费，每到一地他都在门口等候直至结束游程倒也诚信，我们也权作一次支持吧。
M23****6898,2020/6/17,5,体验很好，景色不错，
sandy2618,2020/6/16,5,孔庙，孔府值得一看，在里面慢慢走，蹭蹭导游讲解，还不错。姓孔的还可以免票，孔林位置离孔庙孔府稍远，可看可不看，当然到了不去又说不过去，但是实在没啥东西看。
oppttt,2020/6/16,5,景色不错，体验很好，值得推荐，
M11****100,2020/6/15,5,文化旅游值得！
奥默克,2020/6/15,5,祖师爷的地界，好多人来这里朝圣！
半悟山人,2020/6/15,4,文化意义高，总体不错
白小华,2020/6/14,4,历史意义和文化意义更重
M22****3512,2020/6/14,5,景色不错，值得推荐，体验很好，有趣好玩，
186****8572,2020/6/14,5,值得推荐，景色不错，体验很好，
M21****169,2020/6/13,5,体验很好，值得推荐，景色不错，有趣好玩，
M50****725,2020/6/13,5,体验很好，值得推荐，有趣好玩，景色不错，
M38****7280,2020/6/13,5,体验很好，值得推荐，景色不错，有趣好玩，
M24****7818,2020/6/13,5,历史底蕴厚重，经典传承，不愧世界上唯一的最完整最大的家族，古往今来，仅此一家！
lisayy,2020/6/12,5,雨中游，值得一看
若梦wyl666,2020/6/12,5,我去过&#x20;不是给人视觉上的享受&#x20;是对人精神上的启迪&#x20;作为中国人应该信奉孔子&#x20;欢迎大家都前来进行学习&#x20;&#x20;的确是不一样的感受&#x20;相信我哟
三孔景区,2020/6/12,4,"现在门票半价70元一个人，导游费用的话是一个景点100元，三个景点240。孔林里的电动观光车20元一个人。

还有就是大家找导游记得找一个能说会道的！！没有导游讲解的话就挺无聊的

孔府和孔庙紧挨着，大概一个半小时就能转完，孔林里离孔庙大概两千米吧，可以开车去，而且附近还有马车可以坐~
                            
	                            
		                            "
三孔景区,2020/6/12,5,"来到圣人孔子故乡曲阜，一定要去看看三孔，作为老师的我，学习孔子文化和理念是必修课，他老人家可是师祖。走进三孔，才知道孔子文化的博大精深，2000多年前就已经孕育如此灿烂的文化底蕴，一直流传至今，是中华民族宝贵的文化遗产。“因材施教，有教无类”的平等教育理念一直惠泽着世世代代的中国人
                            
	                            
		                            "
M16****273,2020/6/11,5,很有文化底蕴得地方，值得去好好品鉴。值得推荐，
三孔景区,2020/6/11,4,"首先到达景区后，会有很多导游向你推销，包括照相（这边给大家建议：导游可以讲价景区一个30元，或100元包3个景区，照片一张5元或3张10元）
接下来购买三孔景点联票，（原价140，最近特价70元）在买票时售票员会推荐你购买30元的车票（这边要注意的是这个30元车票实际没用处，推销说豪华大巴往返接受，可以全程免费，实际上是公交车，而且孔府距离孔林很近，外面也有很多马车，三轮车等等，砍价5元大叔很乐意载你去，因为孔府和孔林实际2公里多，如果不嫌麻烦的话走路10分钟就到了（这边需要注意的是一定要让马车大叔送你们到孔林的售票处，不然他很可能直接把你拉到路边，然后对你说走进去就是了，实际上还要走几百米才能到售票处）
接下来我们说说旅游路线：孔庙：整条路线都是由南向北，也就是说从售票处一直玩到大成殿！
孔庙到孔府怎么走？孔庙的售票处进来没多远，右边有个提示牌，有个小门出去左转直走大概350米，然后右转就到达孔府，孔府大门进去大概过2-3个院子后面就是后花园，往左边里面走，靠近左边的一个小门出去右转直走250米右转会看到很多吃的，还有看到很多马车，三轮车，公交车，这些就是去孔林的车，也可以自己导航走路过去孔林（孔林的话里面都是墓地，游览车不必要买，只要去看看孔子墓即可，其他的有时间也可以看看，但人烟稀少，里面也没有什么提示牌）
（最后说点购物消费和用餐建议：在孔庙里面尽量不要买物件，价格都太贵了，里面几百块的，外面孔庙往孔府的这条古董街只要几十块，当然价格你们得还价，正常原价打1-3折，用餐的话，如果不是很饿的话可以等到孔府往孔林的路边有很多吃的比较好吃，靠近孔府后面的这条街卖的比较贵，靠近孔林马路边的比较实惠，注意口味这边人都吃得比较咸，所以要记得提醒老板少放盐！第一次写旅游说说！希望能帮到大家！有什么问题可随时联系我！有什么好玩的景点可以互相推荐！谢谢！
                            
	                            
		                            "
59****023,2020/6/10,5,值得推荐，体验很好，景色不错，有趣好玩，
在路上,2020/6/10,5,体验很好，景色不错，有趣好玩，值得推荐，
阿-欣,2020/6/10,5,值得推荐，
M23****1322,2020/6/10,5,去的时候有些地方在施工??
三孔景区,2020/6/10,3,"坐标:鼓楼街18号

记忆中是分两天逛完的
晚上还去曲阜师范逛了一下
说是逛  就只是从学校正门走到离正门最近的（可能教学楼也可能是宿舍楼  哈哈哈）
对曲阜最深刻的记忆是
吃饭让人发愁
每一餐都不好吃
连火锅都不好吃
宁愿吃泡面
街边小超市卖的还 挺贵的
不想再回忆了
                            
	                            
		                            "
喜行于摄,2020/6/9,4,好客山东，首推当属泰山与三孔，儒家圣地，中华传承，一生必去之处，亲身体会中华文明重要的起源之一！
M565563654525,2020/6/9,5,景色不错，值得推荐，体验很好，
三孔景区,2020/6/9,5,景区服务还是不错的，在售票大厅就有专人服务现在全线门票半价，只要七十就能游三孔
_WeCh****32488,2020/6/8,4,整体景区很大，跟着电子导游介绍听还是很不错的值得推荐，
_WeCh****34378,2020/6/8,4,值得推荐，
麦田守望者,2020/6/8,5,值得推荐，体验很好，
189****8877,2020/6/8,5,值得推荐，
曲阜三孔,2020/6/8,1分 不佳,感受孔子文化还是去尼山圣境吧
三孔景区,2020/6/8,5,"去过泰山之后来了曲阜
在当地三轮车夫的建议下，规划了游玩路线。
孔林→孔庙→孔府
早上先转了孔林，这是一片私人墓地，里面埋葬了孔子以及他的儿子和孙子。后来姓孔的人也可以埋在这里。
中午吃过饭后，开始转孔庙，比较有名的应该是里面的大成殿以及鲁壁。一定要听着讲解员的讲解，三分看七分听。典故还是都很有意思的
从孔庙出来就是孔府了，这个建筑看着比较新，内部可看的东西也不如孔庙多。
                            
	                            
		                            "
倾V听,2020/6/7,5,适合带孩子来熏陶一下儒家文化。
138****8116,2020/6/7,5,历史气息浓厚
205****250,2020/6/7,5,体验很好，
_CFT01****4204090,2020/6/6,5,入园很方便，直接刷身份证就可以进去，联票70还是很值得。其实感觉三孔目前值得一看的就是孔庙。所以如果是原价的话性价比就不是那么高了。孔庙确实是很值得一逛，孔府的话感觉就没什么意思了，好像没有老的建筑，天气太热，走马观花了一下就结束了。孔林的话没有去，因为以前去过了，而且也没什么可看的。加上时间关系就选择去了新开的孔子博物馆。
M23****0942,2020/6/6,5,孔庙孔府孔林，第二次去了，次次意犹未尽，有机会再去细品
三孔景区,2020/6/6,5,"三孔景区是孔府、孔庙、孔林的统称，是孔子的故里也是孔子及其家族的墓葬之地。三孔景区是至今保存最为完好的孺家文化古建筑群，也是与北京故宫、承德避暑山庄一起被评为全国重点文物保护单位的世界文化遗产，非常值得国人前去参观游览。就是景区停车比较麻烦，我是绕了好几圈才找到了停车位，而且走到景区门口有很长一段路。景区门口有很多小饭店，特意品尝了山东的煎饼大葱，改良过了，味道非常不错！
                            
	                            
		                            "
M40****2512,2020/6/5,5,人文景观&#x20;非常值得拜访一下值得推荐，
138****1577,2020/6/5,5,疫情期间游客少，比较清净。孔庙、孔府部分在修缮中，没有开放。去孔林交通&#x20;不是太方便。
曲阜三孔,2020/6/5,2分 一般,曲阜孔林孔庙孔府，一到门口导游，卖东西的一拥而上，很明确的告知不需要，还死缠烂打，三个景点都如此，搞的人很是不舒服，希望有关部门能管一管
醉书生809,2020/6/4,5,孔府孔庙都不错，孔林就算了，相差几公里，车费啊20块钱
东篱先生,2020/6/4,5,孔庙是必须要去看的地方
三孔景区,2020/6/4,5,"果然是一个去了就后悔不去也后悔的地方。
三个景区不是在一起的，中间有一段路需要坐车。
整体还不错，古色古香。进去了可以拜一拜。三个景区转了遍
如果路过的话可以去看看，专程前往去意义不大。
学生证可以打折，票价不贵。
                            
	                            
		                            "
三孔景区,2020/6/4,5,"景区位于济宁曲阜是世界文化遗产，世界三大圣城之一，国家 5A级旅游景区，与北京故宫、承德避暑山庄并列为中国三大古建筑群。
票价不便宜，不过占地面积极大，游览时间长，加之它的历史、文化、艺术的重要实物价值，这个价位也是情理之中。就在市中心，位置优越，景区内古树参天，绿化极好，更衬得建筑庄严肃穆。非旺季仍然人山人海。观光者络绎不绝。
                            
	                            
		                            "
altman35,2020/6/3,5,有趣好玩，景色不错，
YL雅量,2020/6/3,5,值得推荐，体验很好，
300****656,2020/6/3,4,全国开会要求六月二日庙门都开，可孔庙里面石刻什么都关着，周公庙、颜庙、少昊陵都关着干什么，本来就去的人少，还这样，市长可以下课了
三孔景区,2020/6/3,5,"曲阜三孔(孔府孔庙孔林)，旅游圣地。
景区内古树参天，空气清新，环境优雅。
侧柏圆柏，郁郁葱葱，饱经沧桑，造型独特。
各种石碑，帝王墨宝，令游客流连忘返。
游览完毕，乘坐传统马车，体验一下古人的交通工具，美哉美哉!
圣人故里欢迎您!
                            
	                            
		                            "
三孔景区,2020/6/3,5,"近距离感受儒家文化气息。
所谓：“鲁城中有阜，委曲长七、八里，故名曲阜。”曲阜作为孔子故里，被誉为“东方圣城”。三孔则是曲阜必来的景点。
跟随着导游的脚步，走过“金声玉振”牌坊，走过孔子手植的古树……感受到处处透露出的浓郁的历史气氛，古色古香的建筑保存很完整，古老而悠久。
每天早上八点会有开城仪式的表演，建议早点去哦
                            
	                            
		                            "
紫色优雅神秘,2020/6/2,4,带孩子去的，里面在修建，里面有很多都变，没有什么看头，
昱1967,2020/6/2,5,景色不错，值得推荐，有趣好玩，
三孔景区,2020/6/2,5,"三孔景区，非常大气有文化底蕴的景区，景区里还有活了2000年的柏树，孔子文化传承几千年真的很伟大，60岁老人直接刷身份证免费入园，成人三孔景区票70元一张，导游200元，马车100元，电瓶车20元一位，扇子6元一把买的，导游说最低5元能买到，逛完三孔走的时候买点山东大煎饼。
                            
	                            
		                            "
118****399,2020/6/1,4,70元三孔景区门票价格便宜。景区旅游专线车价格太过分了，野导游太多。值得推荐，
东篱先生,2020/6/1,5,孔庙很好，历史文化气息很浓厚，孔府还真一般
wo想出去看一看,2020/6/1,4,有文化内涵，值得一来
139****9548,2020/5/31,5,景色不错，值得推荐，体验很好，
避喧小筑主人,2020/5/30,4,古迹保护的不错，可惜里面古树死了不少。
118****840,2020/5/30,5,历史名胜古迹，弘扬中国文化之地。
曲阜三孔,2020/5/30,2分 一般,体验不佳，
BetTerDAY,2020/5/29,5,曲阜三孔成了一个单独的景点，确实是我没想到的，不过也说的通，毕竟万仞宫墙门口的石碑上就是把三孔写在一起，打包起来也是正常的
六月传歌,2020/5/29,5,孩子研学教育好去处，值得推荐
smillsun22,2020/5/29,5,值得去！特别是带孩子一起！体验很好，景色不错，有趣好玩，值得推荐，
三孔景区,2020/5/29,5,"孔府、孔庙、孔林―统称为三孔景区，位于孔子的故乡―山东曲阜。孔子是伟大的思想家、教育家，儒家思想影响了世世代代的中国人。三个景区最推荐的就是孔庙了，光看景区门口的古树就知道历史相当悠久了，里面还有古代礼仪表演。
                            
	                            
		                            "
M24****5471,2020/5/28,5,有趣好玩，值得推荐，
别让阳光照到我,2020/5/28,4,很有文化内涵的景区，疫情期间价格也很合适，适合带孩子来体验、学习
傲海蓝鲸,2020/5/28,5,值得一去，可以感受中华儒家文化的博大精深。
yu711219,2020/5/28,5,历史岁月沧桑
笑着流泪,2020/5/28,4,曲阜三孔景区，位于山东省济宁市曲阜市，老城内，是曲阜市最著名的景区景点。包括孔府，孔庙，孔林。是世界文化遗产之一。也是国保单位。
我是热带鱼,2020/5/28,5,先登完泰山，然后再去曲阜！曲阜三孔值得花上一天的时间，请一上一位导游，慢慢的品味！
M15****261,2020/5/27,5,儒家圣地，感受中华悠久的历史文化
木子岳,2020/5/27,5,体验还可以景色还可以吧
小二郎儿,2020/5/27,5,体验很好，值得推荐，景色不错，有趣好玩，
三孔景区,2020/5/27,5,"初到曲阜，带孩子感受下，景区不错，门口车夫和讲解导游拉客严重 感觉不太好。其他都不错， 60岁以上老人 及1米4以下儿童免门票 工作人员服务到位。疫情期间持绿码 扫身份证或手机上的电子票进景区 很方便。 值得带孩子学习 感受下。网上免费讲解很多 大家可以去一些平台 边收听边游览
                            
	                            
		                            "
三孔景区,2020/5/27,5,"推荐理由：
山东，孔孟之乡，三孔的规模宏大，确实能看到历代皇帝对孔孟之道的推崇，跟着导游可以学习的东西不少，钩心斗角，杏林，带着孩子去意义更大

交通：
公司组织团游，很是方便不用操心，轻松了不少，有价值的一次旅游
                            
	                            
		                            "
M36****6441,2020/5/26,5,值得推荐，景色不错，体验很好，
M40****1272,2020/5/26,5,体验很好，值得推荐，
118****153,2020/5/26,5,中国值得推荐，体验很好，景色不错，文化传承
三孔景区,2020/5/26,4,孔庙来打卡，仿佛走进了故宫一般，35度的大太阳天，晒晒更健康
三孔景区,2020/5/26,5,"交通：
打车去的很方便。

tips：
一定要请导游，两个景区半价100元讲解费，大概2小时，因为是人文景区，不请导游根本听不懂。

推荐理由：
孔府，孔庙，孔陵，儒家文化的博大精深，各个朝代对儒家文化的宣扬，还有各种自碑，很值得一看。
                            
	                            
		                            "
138****2273,2020/5/25,5,孔府是个非常值得来的地方，增长知识。要请个导游。一路上空气清新&#x20;导游讲解，愉快的心情&#x20;离领悟增长见识。
_WeCh****253075,2020/5/25,4,体验很好，深受教育。
笑着流泪,2020/5/25,4,曲阜三孔景区，指的是空府，孔庙和孔林。联票一共70元，可以两天内玩三个景点，但是每个景区只能参观一次。60岁以上凭身份证免费。
M13****096,2020/5/25,5,值得带孩子去熏陶一下儒家文化
320****825,2020/5/25,5,酒店的环境很好，停车也很方便，大堂经理和房间服务员的态度很好，还很贴心得为我们准备了小礼物！香格里拉值得入住！
树懒的旅途,2020/5/24,5,非常值得细细一游的地方。尤其孔庙孔府，可以多花一点时间看看，租一台讲解器，一路细听细看，很有意思。特别推荐在孔庙里的小卖部买一套孔子生平连环画。
_M13****5104,2020/5/24,5,有趣好玩，景色不错，
M49****045,2020/5/24,5,值得一去，不虚此行，赞一个。&#x0A;圣人故里。
M31****078,2020/5/24,5,上午早点去，从最外面的孔府大道到检票口还有一段距离，可以雇个马车??。需要注意的是三孔很大，走路会需要很长时间，关键磨波棱盖(?＞?＜)☆建议过了检票口乘个车，好像是20一位，另外一个原因是第一站孔林，大家不想在满是墓地的林子里漫步吧…&#x0A;下面的孔府和孔庙非常有教育意义，完全匹配小故宫的美誉，大家在后面要慢走，细品。&#x0A;最后注意的一点是从进到出不是一个地方，到时候还得需要马车拉回原点，一般马车早就候着啦，不需要重新雇车了祝玩的愉快。
1352194zzzz,2020/5/24,5,景色不错，值得推荐，
M94****16,2020/5/24,5,体验很好，
_WeCh****139159,2020/5/24,5,体验很好，值得推荐，
三孔景区,2020/5/24,5,学校就在曲阜 已经去了很多次了 每次去都有不同的感受 古树很大 走在路边感觉很凉爽
三孔景区,2020/5/24,5,去哪里感受了儒家文化，可以带宝宝去熏陶一下
_CFT01****4601044,2020/5/23,5,体验很好，有趣好玩，值得推荐，
M31****3007,2020/5/23,5,体验很好，有趣好玩，
M23****5818,2020/5/23,5,值得推荐，体验很好，
杰杰陶TAO,2020/5/23,5,曲阜三孔是来山东曲阜旅游，必去的景点，没有之一。所谓的三孔就是孔庙，孔府，孔林。其中最值得参观的是孔庙，其次是孔府，最后是孔林。孔庙和孔府是在一起的，离得很近。孔林稍微远一点点。
奕爱旅行,2020/5/22,4,值得推荐，
朝霞浮萍,2020/5/22,5,曲阜三孔是来山东曲阜一定要来看的一个景点。原本曲阜三孔的门票如果买联票是140元。单买孔庙是80元，孔府是60元，孔林是10元。现在是对折70元。如果有机会来曲阜，一定要看看这里哦。
SunnyANn,2020/5/22,4,毕竟孔子，文化第一位，旅游车有点坑，建议徒步游览
三孔景区,2020/5/22,3,很累而且没有地图啥也不知道什么都得自己打听，不像景区
_CFT0****7842,2020/5/21,5,值得推荐，
red****hz,2020/5/21,5,值得推荐，
M19****657,2020/5/21,5,体验很好，景色不错，值得推荐，有趣好玩，
duyanpeng_1984,2020/5/21,5,拜孔子一定要来的地方，文化气息很浓。
三孔景区,2020/5/21,4,"去年天最热的时候去的，差点被烤化，介意小伙伴一定要找一个景点的解说，不然自己看就是走马观花，反正我是，我下次去一定要找个小导游啊啊啊啊啊啊啊啊啊啊啊啊啊啊啊啊啊啊啊啊啊啊啊啊啊啊啊啊啊啊啊啊啊啊啊
                            
	                            
		                            "
M13****722,2020/5/20,5,值得推荐，体验很好，有趣好玩，景色不错，
M27****4503,2020/5/20,5,值得推荐，景色不错，有趣好玩，体验很好，
开学又幸福,2020/5/20,4,山东省济宁市的曲阜非常有名，因为他是孔子和孟子的故乡&#x20;这个地方很是盛名可以来看看
