user,time,score,comment
三孔景区,2021/4/29,5,"曲阜三孔是中国著名的旅游景点 ，凡到山东旅游必到曲阜。前不久，我和同学相约乘高铁到曲阜旅游，整个游程很顺利，当地旅游服务措施很到位，感觉很满意。
一，从高铁站可乘坐K01公交车就能直达孔庙南门，非常方便，票价3元，60岁以上的游客凭身份证可免费乘坐。
二，路牌、售票处及卫生间等各项便民服务设施很多，标志很清晰。孔庙、孔府、孔林票价分别为80元、60元、10元，60岁以上的游客可凭身份证免费参观噢。
三，三孔历史传承久远，文化积淀深厚。要想看的懂，玩的好，还是得请个专业的导游，才能了解景点背后不为人知的精彩故事。
        我们一行6人请导游讲解了孔庙孔府，导游费用100元，通过微信支付给曲阜旅游服务公司，我们找的这位导游比较敬业，在孔庙孔府参观的两个多小时里，细心讲解，周到服务，让我们不虚此行。
       以上信息仅供到曲阜旅游的朋友们参考。
                            
	                            
		                            "
三孔景区,2021/4/27,5,"位置：山东省济宁市曲阜市鼓楼街18号
交通：可以乘坐市内公交车1小时左右
时间??：8:00-17:00
门票：140元联票
～～～～～～～～～～～～～～～～～～～～～??????????????????????????????
??景点：
三孔景区包括孔府，孔庙，孔林，你可以购买景区联票，还可以租导游200元三个景区讲解，还有景区交通费50元左右，孔庙是孔子工作的地方，孔府是孔子后人生活居住的地方，孔林是孔子及后人的墓地，这里是名胜古迹，没有导游你会很懵逼，所以最好听导游的，还有就是看到好多人说背论文免门票，去的时候貌似因为疫情停止了这个，可能是我没找到，总的来说，这里还是挺大的，各种建筑和牌坊各式各样，历代君王都曾来此祭拜过，先贤圣哲比比皆是！
??????????????????????????????
?总结：
三孔景区是在一起的，形成完整的景区，孔子作为儒家思想文化的传播者和创造者，很多言论都是至理名言，形成我们生活的指引，孔子被称为万世师表，值得过来祭拜！
                            
	                            
		                            "
三孔景区,2021/4/27,5,"三孔：孔府孔林孔庙
三个景区之间有拉人载客的小马，沿途小摊有卖孔子的纪念牌什么的，济宁曲阜为孔子故乡，孔子创立儒家文化，为此后2000多年的中国历史深深地打上了儒学烙印。以孔子为代表的儒家文化，按照自己的理想塑造了整个中国的思想、政治和社会体系，成为整个中国文化的基石。
                            
	                            
		                            "
Vicky-小糖,2021/4/26,5,曲阜孔庙，是祭祀中国古代著名思想家和教育家孔子的祠庙。&#x20;它具有东方建筑特色、规模宏大、气势雄伟，与北京故宫，承德避暑山庄并列为中国三大古建筑群&#x20;。曲阜孔庙又称“阙里至圣庙”，与南京夫子庙、北京孔庙和吉林文庙并称为中国四大文庙。&#x0A;我们来时这里游客不多，可以细细追寻伟大的思想家孔子的足迹，想起了各种“子曰”。孔庙中种植了很多的侧柏和圆柏，树龄都非常古老，很多树皮上的鼓包已经被游客的手摸出包浆来了。
M42****2376,2021/4/26,5,景色不错，有趣好玩，性价比高，总体超赞，
三孔景区,2021/4/26,5,"终于来到了至圣孔子的三孔，作为中国人除了承认自己是炎黄子孙，龙的传人，自古还得加一句是读圣贤书长大的，当然这些圣贤中至圣的就是这万世师表孔子了！
孔子的地位无需赘述，三孔是孔庙，孔府，孔林，孔庙是孔子后人建立宗庙的地方得到了各代帝王的封赐，孔府就是孔子后人居住的地方，孔林则是孔子及其后代死后安葬的居所！
还是值得一去的，很多悠久的典故，神奇的现象，记得一定要找个导游哟！
                            
	                            
		                            "
asphodel,2021/4/25,5,广东有学前考前拜孔子的说法，五年前带着大娃去了一次，这次带着小娃，入住的jw鲁能万豪，游览全程步行，孔庙正门进，孔府后门出，跟着指引，不走回头路&#x0A;这里说说孔林，第二次去了，才印象深刻，真没必要坐游览车，可以直接进去走到孔子陵墓祭拜，游览车是把陵墓绕一圈，我们这种比较忌讳的，我觉得拜拜孔子就够了！
206****393,2021/4/24,5,有趣好玩，性价比高，
xyong2001,2021/4/24,5,景色不错，总体超赞，
M45****5955,2021/4/23,5,历史厚重。
三孔景区,2021/4/23,5,"门票直接从美团买就可以了，三个景点140块，感觉有点贵
一进入景区范围，就会有导游上来问要不要讲解，最开始一个景点100块，后面又降价到50，在孔林导游只需要10块了。个人觉得不需要找导游，实在想了解历史的可以租个讲解器30块。园内有很多带队导游，可以去旁听的。
从孔府到孔林，其实可以走过去的，不是很远。如果想坐车（电动三轮），超过两个人5块钱就可以还价了，还可以试试坐马车。
孔庙和孔府看的点比较多，印象比较深的就是园内几百年的圆柏，柱子上的五爪龙，勾心斗角，东瓶西镜、始钟有镜，六代含饴以及五柏一槐了
想了解每个大殿，门等典故的可以在导游讲解那认真听听，孔林主要就是看孔子和孔鲤的墓，毕竟是墓地，还是不要拍照的好。
                            
	                            
		                            "
M33****1565,2021/4/22,4,孔林&#x20;震撼。
叶儿随风而飘,2021/4/22,5,在携程网订的这酒店，非常不错，准老四星级酒店，曾经是***领导及***等外国首脑下塌的宾馆，有一定的荣誉感??酒店外装古老庭院***风格，前台和服务员服务热情，房间很温馨，欢迎水果还有孔子论语小礼品??尤其是位置俱佳，离孔庙孔府超近，左边步行街，右边孔庙，后面是孔府，出行超方便??停车位很大，餐厅包厢十分爆棚，估计有特色有气派的餐厅！早餐丰富，晚上正厅二楼还有免费传统节目观看！强烈推荐！！！我若再来还会选择阙里宾舍，也会推荐朋友住这！&#x0A;房间卫生舒适！有照片但上传太慢，要外出只好取消上传相片
new****lu,2021/4/22,4,成熟的景区，但管理一般，文字介绍很少。很多人拉你买东西，叫导游。
320****092,2021/4/22,5,儒家的创始人，值得虔诚地参拜，那天我们怀着崇敬的心情，瞻仰了孔老夫子居住地和陵寝地，为我们祖国有这样的先贤，而感到骄傲！
三孔景区,2021/4/22,4,"第一次到曲阜，第一次参观孔庙孔府。
昨天谷雨时节，早上酒店窗外沥沥下起了小雨。
幸幸好，今天行程计划中的孔庙、孔府与酒店近在咫尺，一墙之隔。
我们打雨伞去逛孔庙、孔府。
雨中散步一般走进游客不多的三孔景区。
孔庙的规模真的很大，也很安静。
建筑风格宏大气派。
孔府保存完好如初。
今年是孔子诞辰2572周年。
唯一遗憾的景区管理还是不太细腻，不如江浙一带的景区，尤其是古镇庙宇，例如孔庙内的拉圾筒、消防器材与周边建筑及古树色调不搭，既影响美观又不利于拍照。这是细节管理的问题，建议改进。
                            
	                            
		                            "
2233安安宁宁,2021/4/21,5,入住曲阜市阙里宾舍，环境和地理位置都还好，第一天散步孔府，第二天孔庙祈福，第三天补觉。行程比较宽松，带了戒尺，孔子书签和桃木剑回来，曲阜的景区收费非常人性化，老人和儿童免费，姓孔的也免费，好客山东，性价比高，总体超赞，很有大家风范。
M33****1565,2021/4/21,4,老师人很好&#x0A;&#x0A;有点儿小贵
M46****936,2021/4/20,5,可以，接待朋友
woolynn50,2021/4/20,5,孔子故乡曲阜有祭祀孔子的孔庙、孔子嫡系居住地孔府、孔子及后裔的墓地孔林，统称三孔，孔夫子生前在此首创儒家文化并由后代传承着其文化思想…一般逛的顺序为孔庙，孔府和孔林，前两者挨在一起，孔林要稍微晚点，可打车前往，孔庙规模很大，最有看头，是重点，最好请个导游，了解文化…
三孔景区,2021/4/20,5,"孔子故乡曲阜有祭祀孔子的孔庙、孔子嫡系居住地孔府、孔子及后裔的墓地孔林，统称三孔，孔夫子生前在此首创儒家文化并由后代传承着其文化思想…一般逛的顺序为孔庙，孔府和孔林，前两者挨在一起，孔林要稍微晚点，可打车前往，孔庙规模很大，最有看头，是重点，最好请个导游，了解文化…
                            
	                            
		                            "
千纸鹤0421,2021/4/19,4,景色不错，
320****636,2021/4/19,5,值得参观？
M29****8027,2021/4/19,4,孔子的影响非常深远，幽静有底蕴，孔林不必去了，当地姓孔的非常多，人也热情好客，菜量大总体超赞，
孔卡尔德李清照,2021/4/18,5,孔子儒家思想和文化影响流长百世，传遍五湖四海，学习孔圣人思想精髓，跟着讲解熟悉回忆历史故事，适合各个年龄段朋友，喜欢历史的朋友更值得一去。
yytk14,2021/4/18,4,总体来说可玩性一般，但是景色还是不错的，可以随便逛逛顺便科普下知识了解了解孔子。假期的时候人还是挺多的，也有很多导游揽活做讲解，可根据自己的情况选择。
三孔景区,2021/4/18,4,"2021年4月18日从泰安开车来曲阜
?停车：一定要导航“三孔景区停车场”，停车费10元，这个是正规的。
门票：孔庙80元，孔府60元，孔林10元，老年人免费，连票140元
区间车30元，当天无限次乘坐，还可以送到高铁站，还是很不错。
孔林电瓶车20元，老年人10元

孔庙，很大，逛的时间最长，上百年上千年的柏树，一定要请导游！100元/导游，租个耳机 10元（听得清楚，有一定距离也能听到）
孔府，很快就逛完了，后花园有三大奇观
孔林，孔家墓碑?，个人觉得可以不去，如果就是想去看看，那就逛逛吧，一道都是墓碑，柏树和紫色的小花，走半圈3km多，用时50分钟吧。
                            
	                            
		                            "
三孔景区,2021/4/18,5,"来山东怎么能不来孔子之乡呢
早晨从泰安做大巴过来，一个多小时的路程，下来又坐了几站公交方到景区。
三个景点连在一起，所以路线串联，一次就能逛完
孔庙，孔府，孔林。
感受了儒家文化发源，光是从里面千年古树都能看出历史文化的厚重感，不愧是万世师表
                            
	                            
		                            "
M61****920,2021/4/17,4,交通相对方便，景点还好。听听历史。
手牵手逛地球,2021/4/17,5,孔子故里，文化圣地，挺好的。自己逛，没有导游讲解，有点看不懂。&#x0A;孔子故里，文化圣地，挺好的。自己逛，没有导游讲解，有点看不懂。
三孔景区,2021/4/17,5,"#回忆帖#毕业之旅，来孔庙祈求个好成绩也是不错的一个选择。还是蛮**的，心想事成了！看得出世代帝皇对孔子的尊崇，历史悠久的三孔，景区内的林木非常的上年纪。山东区域内不多的五星级景点，游玩性一般，文化学习好去处！
                            
	                            
		                            "
昌图司马攸,2021/4/16,5,总体超赞，景色不错，有意义性价比高，
Gloria1103,2021/4/16,5,自驾去山东出差路过曲阜，跟着导航到停车场，但是从停车场到达景点大门的路途有点远，搭了一段三轮车。三轮车师傅很健谈，孔庙和孔府挨着，孔林需要开车再走一段路。孔庙规模宏大，历史悠久，孔府不愧是天下第一家，受到历代皇帝的重视和扩建。暑假可以带孩子好好再来学习下
龟速狂飙,2021/4/16,4,导游总是把我们朝购物的地方带。
三孔景区,2021/4/14,4,2000年儒家思想的起源，影响整个封建时代的历史，朝拜文化的圣地。
286****463,2021/4/13,5,性价比高，有趣好玩，景色不错，总体超赞，很有文化底蕴，很适合带孩子和喜欢历史的老人出行。出票很快，价格比景区买便宜，入园也很方便。????
三孔景区,2021/4/12,5,"有幸去山东学习了一下孔子文化，真的是一个有文化气息的城市，整个城市很简朴，当地的虫子菜和大白馒头特别让我记忆犹新，很有特色。穿上孔子学服饰，叩拜孔子像，读孔学，很有仪式感。受益匪浅。有机会下次还会再去的
                            
	                            
		                            "
M28****3405,2021/4/11,4,带孩子玩玩
放过自己吧,2021/4/11,4,这个三孔套票比单独购买孔府孔庙孔林门票便宜十块钱吧，喜欢历史文化的人到这里来参观一下，还是非常非常不错的，。
虹化公子,2021/4/11,4,如果没有讲解，除非特别了解孔子和儒家文化，否则看起来，只能是景色一般，纯粹的感受一下氛围。当然，当地导游基本都差不多，看个人选择了。
_WeCh****126190,2021/4/11,5,***
白木雨林,2021/4/11,5,很好，值得一去。
happy小猴子,2021/4/11,5,感谢导游娜娜细致的讲解
菜鸟鹰,2021/4/11,5,性价比高，景色不错，有趣好玩，总体超赞，
清风拂面1022,2021/4/10,5,总体超赞，
631****142,2021/4/10,5,遇到了好的解说，非常到位，把孔子的生活表达的淋漓尽致，还会灌口，总体超赞，值得一来！
M27****8321,2021/4/8,5,景色不错，有个碑林喜欢书法可以看看，
M41****415,2021/4/8,5,孔林的孔庙，孔府，曲阜的三孔。
曲阜三孔,2021/4/8,2分 一般,门票价格有点高性价比低，
美丽的地球,2021/4/7,5,非常值得一去的景区，就是各个景区之间的交通不是很方便。
-_-_-,2021/4/7,5,门票很方便，刷身份证即可。地方不大，半天可以看完孔庙和孔府，最好请个导游o讲解一下。孔林是第二天去的，除了孔子及其子、孙墓之外，实际就是孔家墓地，随便看看了
三孔景区,2021/4/7,5,"三孔(孔府！孔庙！孔林)！孔子的故乡！我国文化的发源地！丰厚的文化底蕴！
孔府！是以前孔家人居住的地方，里面房屋布局合理，古典的中国传统建筑，但也处处提现着严重封建的思想。
在孔庙里，有些大大小小的庙宇，各个历史悠久，房梁上的牌匾都是各个皇帝的提笔作品。
                            
	                            
		                            "
古儒2404,2021/4/6,5,方便与快捷，较好避免不必要的拥挤。这次正好在清明季节去祭孔，
三孔景区,2021/4/6,5,"山东曲阜一日游
      终于来拔草了，多少游客必来游玩的圣地。
     这里野导游太多，缺少管理，走哪里跟哪里很烦人。还有人工三轮车夫跟着屁股后边问个不停。想好好享受一下游玩的感觉一下就没了。
      进到孔庙就不会有那些人跟着了，游客也不是很多，观看了年代碑文，因为年代太久，有些模糊了。
     孔老夫子，看到他的第六十七代传人在给游客用姓氏+名字作诗在扇子上留纪念。
    了解一下历史文化充实一下自己，还是不错的。
                            
	                            
		                            "
栖居云霞,2021/4/5,5,总体超赞，
仲夏夜闪闪萤火虫,2021/4/5,5,赞。zzzzz
118****787,2021/4/5,5,非常值得去看
L弓贯日,2021/4/5,5,挺方便的呢
F冯建国,2021/4/5,5,到了山东，一定要到曲阜三孔看看，尤其是在春暖花开的季节。
_WeCh****972850,2021/4/5,5,还行景色不错，
DavidRen,2021/4/5,4,比较无聊的景点
M44****8794,2021/4/4,5,值得走一走，看一看，逛一逛。
e10****05,2021/4/4,5,人很多啊，很多旅行团，一个门槛接着一个门槛，要懂历史才能好好感悟。
138****6028,2021/4/4,5,刘导讲的确实很棒，这个钱花的超值！深入浅出，引用典故，用孩子也可以听懂并接受的话语娓娓道来。三个小时的时间，一晃而过！来曲阜，学的是文化，靠谱的讲解，真的太重要了！
wang juan,2021/4/4,5,景色不错，
安塔利亚隆科多,2021/4/4,5,景色不错，有趣好玩，性价比高，尼山书院酒店宾客服务管家裴洪娟服务热情周到！
三孔景区,2021/4/4,5,"游孔庙有感
                       
     我最敬佩的人――孔子
     在历史的长河里有许许多多的名人，就像天空中的星星在闪耀，而孔子就是那颗最明亮的星星，从古一直影响至今。
    孔子名丘，字仲尼，是春秋时期鲁国人。我国思想家，教育家，是儒家学派的创始人。被后人称为“至圣先师”和“万世师表”。
    孔子是一名优秀的老师，据说教的3000多名学生里有72名杰出人物呢！他教弟子的话被弟子们写成一本书，便是大名鼎鼎的w论语》。其中有一句话令我印象深刻，“言必信，行必果”。指说出的话一定要足以让人信任，行动了就一定要有结果。就像我的付老师说的：做人要有诚信，办事要有效率。所以孔子告诉我们的话直到现在，我们还在遵守呢。
      孔子自己也还是一个勤奋的学生呢：“三人行必有我师焉”。曾经，他的老师教他练琴，几次告诉他，可以练下一首曲子了。孔子却觉得还没有掌握曲子的精髓，依然苦苦练习这一首曲子。十几天后，孔子对老师笑着说这首曲子是讲周文王的吧！老师听完，惊呆了，原来这首曲子就叫：《文王操》。
        孔子有许多至理名言教育了世世代代的学生，正如成化碑所歌颂：天不生孔子，万古如长夜。天生孔子，为天地立心，为生民立命，为往圣继绝学，为万世开太平。孔子将永远活在我们心中。       
                            荔园四（1）班刘雅丽
                            
	                            
		                            "
悦隐86,2021/4/3,4,景色不错，
M23****3640,2021/4/3,5,性价比高，总体超赞，
zhuj****31222,2021/4/3,5,总体超赞，
三孔景区,2021/4/3,5,"三孔景区就是孔庙孔府孔林三个景区的统称
景区不是很大 如果不请导游的话可以进到景区后租一个自助讲解机 押金200 租金三十还取都很方便 只有孔庙知识点多一点 我们到孔府时候门口有讲解只需要20-30就可以了 需不需要导游还是看自己吧
                            
	                            
		                            "
B羽,2021/4/2,5,很不错，孔圣人之地，去了一定要找个导游好好讲解一番，比自己看要好很多，里面最多的就是书法大家的字，鄙人喜好书法，从头买到了尾，各有所好，但是字确实写的不错，对了，导游到里面也有，比外面的要便宜哦，景色不错，有趣好玩，总体超赞，性价比高，
三孔景区,2021/4/2,5,"三孔景区｜山东旅游｜济宁旅游
上周末去了曲阜，看了看三孔（孔府孔庙孔林），蛮有意思，加上春天到了，花花草草都漂漂亮亮的。看的我整个人都心情舒畅了！不过济南去曲阜高速在维修，特别特别难开车～～
三孔的具体情况我想单独写，就先说一下票，摆渡车，导游。
票的部分，我们是决定三处都看看，所以直接买的通票。
摆渡车的部分，觉得有点坑，我们自驾去的，感觉并不是很需要？！孔府孔庙我们连着走完的，之后去了下孔林，最后回停车场。且不说我们自己有车，重点是，俩人打车的钱其实低于两张摆渡车票，还有孔林的停车站老远老远的，有点无语……大家不要像我们，一定先做好功课！！
导游的部分，文化景点，可以请一下导游。不用外面请，走进景点里面就有自动上前联系的。至于价格，大家记得砍价，主要是越往后走，你会听到越来越低的报价
                            
	                            
		                            "
三孔景区,2021/4/1,4,很有教育意义，景区非常大，停车场也很大。
kk****120,2021/3/31,5,里面导游特别多，黑的正规的都有，有些烦人。孔林里面挺大但是感觉没太多意思。主要还是孔府孔庙很震撼，曲阜高铁还行机场交通不便，得去济南坐飞机。
M23****1408,2021/3/31,5,值得一去?
_CFT01****0913190,2021/3/29,5,孔子文化博大精深
112****316,2021/3/28,5,很方便，挺好
186****2020,2021/3/28,5,很方便，直接用
虎哥爱吃兔子肉,2021/3/28,5,孔子可以去看看......孔林&#x20;孔庙&#x20;孔府.....不错的选择....咱们的孔子先贤的地方......人很多，文化氛围很强.
小天-vincent,2021/3/26,5,性价比高，
M19****649,2021/3/26,5,有文化，有内涵，值得一去，好好好
三孔景区,2021/3/26,4,孔庙还是很值得逛一下的，很有文化意义。很多出名的石碑。难得来一次，大家都有许愿和烧香。希望所有人都能愿望成真。孔府的观赏点就少了很多，孔林我们就没有去了。
繁A裸烬,2021/3/25,4,值得带孩子去感受一下文学氛围，景色不错，运气好的话还可以近距离看下孔府大戏台??
老猫猫1,2021/3/24,5,使用方便。
思无邪,2021/3/23,5,孔子故里，三孔景区风景好，人文特色。
xiaomeizhu1009,2021/3/22,5,值得去走走看看。。。个人觉得去这样的地方一定要找讲解员一起！
小圆圆丸子,2021/3/22,5,来曲阜必来，值得一来。
Phonix1415,2021/3/21,5,性价比高，拓展了眼界
王森大人,2021/3/20,5,齐鲁文化圣地，儒家思想发源地，摩拜。
M22****8050,2021/3/18,5,非常喜欢的！景色不错啊！性价比很高！值得游玩！
杰仔sj,2021/3/18,4,景点不错，就是门票偏贵了
天神5982,2021/3/18,5,景色不错，性价比高，总体超赞，
三孔景区,2021/3/18,3,"住宿的地方靠近孔府后门，莫名其妙就跟着人群进了景区
因为时间问题，孔林没有去。
孔府建筑挺好的。不过很多都是空房子，一些地方不听导游的讲解可能不太明白，带孩子去的话可以找个导游或者电子导游。我们是两个人单纯出去玩，没有找导游，只单纯看风景。
出来以后是一个步行街。都是卖的一些小玩意，价格不贵，但卖的几乎一样，有点不好玩。
因为先去的孔府。所以要绕去孔庙。花了大概十几分钟左右。
如果先看孔庙。就会比较顺。出来以后顺着指示牌就能进孔府。
有人力车和马车，人力车大概十元，五点以后就五元一趟了。。。
没有共享自行车。三孔景区已经算市中心了，有停车桩，但是却没有一辆共享自行车，这点有点不友好。而且到了晚上，大街上满都是粪便的味道。
路灯不多，门店关门很早。八点多就基本路上都黑了。
                            
	                            
		                            "
M43****0808,2021/3/15,5,景点不错，
chufuqiang,2021/3/15,4,价格有点高
三孔景区,2021/3/15,5,三孔景区的通票是140建议先去网上看看，有便宜的票，可以订第二天的票，车的话，建议不要买30来回票，坐三轮车也不错，也可以打车，别听卖票的忽悠，给你们的建议哈(*^^)/★*☆
M20****801,2021/3/14,5,文化底蕴深厚，斯文在兹
祺有此理,2021/3/14,5,总体超赞，性价比高，景色不错，有趣好玩，
曲阜三孔,2021/3/13,2分 一般,再也不去了 诈骗太多 各种骗子
118****589,2021/3/12,4,文化底蕴很好，风景漂亮，由于当地政府疏于管理很多地方损坏不少，听导游说有些地方都有损坏，可惜了这么好的历史景观，当地过度消费孔子，导致很多产业没有发展，游览的时候建议聘请一位导游会增加很多知识。
王晨99,2021/3/10,5,总体超赞，性价比高，
63****137,2021/3/9,5,景色不错，
M15844**Nj,2021/3/9,5,千年礼乐归东鲁，千古衣冠拜孔丘。圣人故里，果然非凡。需要批评的是景区导游管理混乱，建议当地旅游部门加强监管，完善管理制度。不要影响景区。
乐多熊,2021/3/9,5,城市很干净，人们很友好，很热情。很好，很满意。
卡马里奥李自成,2021/3/8,5,景色不错，性价比高，
羔羔的妈妈,2021/3/7,5,当然是值得带孩子参拜儒家孔圣人的啊……
E15****68,2021/3/7,5,人间值得。其实是三个小景点，够玩一整天的了。
320****429,2021/3/6,5,值得一去，老祖宗留下的遗产，尤其是年轻人更应该去看看。
M22****519,2021/3/4,5,性价比高，
颠牛,2021/3/4,5,地方不大，都维持原来的面貌还行
