user,time,score,comment
M32****0391,2019/5/30,5,感叹3000年文化底蕴，深有感触。作为中国人我感到骄傲和自豪。老祖宗留下的东西值得我们下一代沿袭下去。
M29****1209,2019/5/30,5,快捷方便，高效率，非常实用。儒家思想久远、久远……
L魔王康德L,2019/5/30,5,感受文化气息，儒家经典文化，很棒
三孔景区,2019/5/30,5,"到曲阜为了看开城仪式，清晨第一件事就在城门外等候。有朋自远方来不亦乐乎～曲阜孔子故里
早晨8：00开城仪式，Q锣开道仪仗队出城古装演出热闹非凡，随后参观了三孔感受我国文化传承，两天曲阜之行感受颇深～曲阜之城不愧为礼仪之邦。
                            
	                            
		                            "
118****609,2019/5/29,5,身份证直接检票非常方便，整体满意！
M31****5854,2019/5/29,4,走过孔子的一生，重新认识了历史上的孔子
M29****5988,2019/5/28,5,挺好的，带孩子去感受感受文化&#x0A;和家人聚聚
花园城的好心情,2019/5/28,5,门票价格合理，三孔值得青少年去受教育的好地方！
M29****3143,2019/5/28,5,仅次于故宫的第二大古建筑群，早上八点看了入园仪式，和快八十岁的老父亲一起转了一天，孔子故里的人都很热情，基本上有问必答。
三孔景区,2019/5/28,5,"在山东省的西南部，有一个孔姓人口占1/5的县级市，她就是有着5000多年悠久历史的""东方圣城""--曲阜。山东旅游一直有“一山一水一圣人”的说法，其中一圣人就是孔子。来到曲阜必访三孔（孔庙、孔府、孔林），这里有联票，三地之间有直达公交车。
1、孔庙 孔子死后的第二年，历代帝王不断对孔庙进行扩建，使其成为一处伟大的建筑群，也是我国最古老的一座庙宇。孔庙的主体建筑大成殿，殿前有一座方亭，名为“杏坛”。
进孔庙之前要先经“仰圣门”，门上有“万仞宫墙”四个红色大字，进入宫墙内，有多个石坊，“金声玉振”坊、下马碑、棂星门、“太和元气”坊、圣时门等等，都是历史悠久古建筑，最主要的建筑就是""大成殿""，大成殿与北京故宫太和殿、泰安岱庙天贶殿并称为“东方三大殿”，骄傲吧山东人，三大殿两个在山东。大成殿外的石柱，更是壮观，简直无法用语言形容，四周廊下环立 28 根雕龙石柱，均以整石刻成，据说龙的总数共计 1000多条，相传清乾隆皇帝来曲阜祭祀孔子时，石柱均用红绫包裹，不敢被皇帝看到，恐怕皇帝会因超过皇宫而怪罪。
庙内有历代皇帝赐赠御碑亭，在这里你会看到孔庙建筑的“勾心与斗角”为孔庙增添了一大奇观，这在全国现存的古建筑群中是很罕见的。
来孔庙旅游最好是请个导游，尤其是带着上学的孩子，我们是在门口与另一家合拼了一个导游，在导游的讲解下，更能了解孔庙的历史及伟大。
2、孔林 孔子死后，葬在曲阜城北，占地三千亩、有古木二万余棵的孔氏家族墓地，世称“孔林”，又叫“至圣林”
3、孔府 北宋政府在曲阜为孔子后代建立的“衍圣公”府，俗称“孔府”。
                            
	                            
		                            "
三孔景区,2019/5/28,5,"印象中当时买的联票加景观车的那种，其实如果时间富裕的话，没必要买景观车的票，景点离的很近，完全可以不行，正好看一看当地的景色，体验一下当地的人文。去景区的话，最好还是找个导游或者租个自助讲解的，毕竟这种人文底蕴深厚的地方，还是很考验功力的。
                            
	                            
		                            "
137****6772,2019/5/27,5,己所不欲勿施于人。文化徒步朝圣
M33****002,2019/5/27,5,喜欢这种有年代感的景点，儒家思想发源地，适合带孩子来感受一下，一个好的导游起到绝对的作用！
尾巴1964,2019/5/26,4,在携程预定了三孔的通票，还是很划算的，孔林没时间去了，下次吧。
E28****23,2019/5/26,5,方便快捷，直接用身份证刷无需取票。
岛城奶爸,2019/5/26,5,很好的地方&#x20;早上一定早点去&#x20;看演出&#x20;要不就没好位置了&#x20;&#x20;导游也很不错
M25****1553,2019/5/26,5,孔子文化世界闻名，可是景区对面的停车场太坑了，希望曲阜旅游相关部门重视一下，停一次要40元，还振振有词的，我们一家自驾出游去的，我们没有停那个停车场里，停在了景区正对面路口南边的路边停车位，离景区也很近，我建议大家可以停那里，无非是往回走五分钟，大家可以参考一下
_sdb62****2110346,2019/5/26,5,感动。论语背诵负费门票。买了论语背诵。
M56****565,2019/5/26,5,很有文化底蕴的一个地方，感谢导游，一路上讲解了很多历史知识。
池来的春天,2019/5/25,5,携程订票已经是很完善的了，取票很快。
300****863,2019/5/25,5,儒家文化发祥地，文化底蕴内涵深厚
m22****5252,2019/5/25,5,带孩子感受儒家思想，很有意义！
139****7575,2019/5/25,5,不错，学生很多，导游姐姐也很好
M32****2542,2019/5/25,4,感觉学了很多知识，体会孔子文化的博大精深
M23****2835,2019/5/25,4,孔庙挺大的，游览了一圈感受到了孔老夫子历史地位尊崇，至圣先师名不虚传。
快乐平安一路顺风,2019/5/25,5,来济宁的朋友们必须要来看看得、长知识
芦苇low,2019/5/24,4,这票不错的，但在火车站时会有黑司机低格送你去景区，但中途会去李傀景点，让你退了再重新购票。这个要小心。
顾独求败,2019/5/24,4,孔老夫子的根据地，历史人文气息比较浓厚，古建筑规模也挺大，游客中心的大巴有点坑，一人30元，说可以送3个景点，实际上游客中心到孔庙也就1公里多点路，而孔府就在孔庙边，根本就不用坐车，就孔林稍微远一点，大概也就3公里多点，只要2人以上，走走路打个车也不用完30元一个人
kissqian8888,2019/5/24,5,景点很好。不仅好看，很值得一看
渣子李先生,2019/5/24,5,从泰山下来并不想马上回家，既然到山东了，绕不开的圣贤就是孔子了，于是改道去曲阜决定去把大名鼎鼎的三孔景区给参观一下，下高铁需要坐公交到市区，距离有点远，而我骑车2个小时才到，孔府、孔庙离得不远，去孔林的话要坐车，三孔景区可以买联票。
冰之炙点,2019/5/24,5,中国好文化，人民2000多年。儒家文化在其中起的作用不可替代。曲阜是孔子的家乡。明代的时候，为了防止土匪，给他们修了一座城墙。孔府孔庙，孔陵俗称三孔。这次去玩学习意义非常重大。&#x0A;建议还是请一个讲解，细细的品味一天。&#x0A;毕竟很多藏文史故还是要听一听。
三孔景区,2019/5/24,5,"三孔景区五一小长假实在是人太多了，三孔景区里、有孔府、有孔庙、有孔琳，统称曲阜三孔，是中国历代纪念孔子，所以带孩子来这里游玩是有纪念意义的，让他们了解一下历史，了解中国的古代最大的祠堂和他的建筑，等小孩长大在去那就和这次就不一样了。
                            
	                            
		                            "
三孔景区,2019/5/24,5,"从泰山下来并不想马上回家，既然到山东了，绕不开的圣贤就是孔子了，于是改道去曲阜决定去把大名鼎鼎的三孔景区给参观一下，下高铁需要坐公交到市区，距离有点远，而我骑车2个小时才到，孔府、孔庙离得不远，去孔林的话要坐车，三孔景区可以买联票。
                            
	                            
		                            "
118****609,2019/5/23,5,很好，讲解很详细生动，又可以回家重温，不错
如梦似水,2019/5/23,5,孔府孔庙还是挺有看头的，历史文化底蕴很丰厚，不过最好跟着或者蹭导游，要不没有丰富的知识或者没有做足功课，可能会看不出历史文化底蕴。孔林差多了，没什么看头，做个观光车十分钟就逛完了，还不如自己走着逛逛呢。
LENTHAN,2019/5/23,5,非常好网上预订的门票用身份证直接入院参观。
秋水依人1971,2019/5/23,5,非常方便，门口刷身份证即可入园
binglingfly,2019/5/22,5,刷身份证就可以入园&#x20;很方便&#x20;联票价格合适&#x20;就是各经典之间都需要步行&#x20;稍微有点远&#x20;整体感觉挺好的&#x20;不错的体验
M32****4571,2019/5/22,5,儒雅文化！！！！！！！！！！！
奥兰纪晓岚,2019/5/22,4,感受儒家思想与文化的博大精深和内涵，受到了很好的教育，学到了不少知识。以后有机会再来一次，仔细地看看
三孔景区,2019/5/22,5,"来到了曲阜肯定要去三孔景区看看的，整个三孔景区，三孔分别是孔府，孔庙，孔林。逛完整个景区的话可能需要3-4个小时时间，由于时间紧迫，我们一行人选择逛了一孔，孔庙。文化气息浓厚的地方必须请导游来讲解历史，不然此行无法更好的感受，人多的话请导游很划算，讲解的也很详细，导游讲解了孔家的家谱，家训，古代字体的由来，乾隆皇帝给孔家的题字等等，强烈推荐真的有必要去学习。
                            
	                            
		                            "
三孔景区,2019/5/22,2,"其实这个大景区还真的蛮没意思的，赶上节假日人也是非常的多，没有什么可来性，不推荐。值得一提的是，景区门口的饭店真的是超级难吃并且服务态度超级不好了，要去的亲们一定不要在景区门口用餐，多忍10分钟，往远了走走再吃饭吧。
                            
	                            
		                            "
133****8619,2019/5/21,4,建筑的规模和历史感都让人震撼，祭祀表演也大开眼界，不虚此行。可惜孔庙中设了太多的商业售点，大煞风景。
绝对好司令,2019/5/21,5,曲阜三孔绝对值得一去，但是感觉孔林很一般，实际上并没有什么东西好看，孔庙还是非常不错的！另外要挑时间去，曲阜的大气污染也重，需要挑天气好时去能更好欣赏美景。
187****1570,2019/5/21,5,景区就是全部卖纪念品的，游玩的很少。每栋房子里面都是卖纪念品的
闲庭信步25,2019/5/21,4,还不错，文化底蕴有，孔庙意义重大。
网络大夫,2019/5/21,5,很方便，刷身份证即可进去。孔庙不错，孔府没意思。孔林其实看一下孔子的墓即可，没必要花20元坐电瓶车。
U44658****369222,2019/5/21,5,历史文化名城，中国传统文化厚重，真是名不虚传，值得一看！
M56****102,2019/5/21,5,孔庙很值得去一次，跟着讲解员了解万世师表孔子的治学、处事之道！最喜欢&quot;其身正，不令而行;其身不正，虽令不从&quot;
205****860,2019/5/21,5,为孩子祈福，夫子保佑，考试创佳绩。学业有成。
M32****6863,2019/5/21,5,不错，方便快捷，不用排队买票，省时省事
要辣的,2019/5/21,4,历史的厚重感，千年文化。虽然儒家现在不是主流，但影响深远。到了这里，看到的，加上听到的讲解，让人有一幅幅画面在眼前划过的感觉
懂得珍惜才配拥有,2019/5/21,5,还可以，综合体验道教文化的传统风俗。景区附近交通方便，旁边就有停车场。适合自驾游、跟团游，给予五星好评，游玩结束附近可以购物。
M29****1903,2019/5/20,5,风景优美，价格实惠，民风淳朴，不错。
junshumei,2019/5/20,4,环境很好，彰显伟大的中华文化底蕴，
_WeCh****190081,2019/5/20,5,省去排队的烦恼，买票直接刷身份证就可以了。
shiyu340,2019/5/20,5,景区不错，卫生间很多，饮料也很多。就是人太多啦。建议请个导游给讲解。自己拍拍照有点遗憾。从携程上买票很便宜。
三孔景区,2019/5/19,2,"真的是感觉一个很坑人的景点，三个景点在一起，就叫做三孔景区，分别是孔庙，孔府和孔林一个是孔子教学的血糖，一个是孔家人的住所，再一个就是他们的墓地。

三个景点的门票一起买的话，价格要140元。你也可以在一些购票的网站上去购买。可以购买那种直接刷身份证就可以进去的，这样会比较方便一些。另外如果你有教师资格证和相关的教师从业的证明材料，你就可以免费了。不过五一节的时候，卖票的地方人山人海，真的是进不去。感觉排队都要把人排死了。
                            
	                            
		                            "
曲阜三孔,2019/5/18,2分 一般,各项服务均不到位，希努力改进。建议向旅游发达省份学习借鉴，实现山东省作为经济大省的重要地位和身价。。
三孔景区,2019/5/17,4,"位置：
鼓楼街上，周边住宿方便，有连锁酒店有民宿，高铁站距离景点有点远，住在市里比较方便。

景点：
正好赶上身份证免费旅游，不是假期人不多，整个三孔景区还是比较大的，孔府和孔庙连起来逛就可以，孔林略远需再换乘一下。
                            
	                            
		                            "
三孔景区,2019/5/14,5,"历史各朝代，孔子被尊为圣，后人都被尊为圣人延续，万代师表，“大成至圣文宣王”。孔子后人们可以算是非常能顺天命，生逢百家争鸣的喧嚣时代，一声颠沛流离。漫步在孔庙中能感受到千年古树生命的力量，伸手抚摸古树的瞬间，不免对这千株不朽的精灵们心生敬畏。在孔庙，儒家文化的底蕴早已同凝重的庙宇、碑林和高耸入云的古树一起镌刻进无垠的历史时空。
                            
	                            
		                            "
三孔景区,2019/5/12,5,陪着爸爸妈妈一起去的，网络购票很方便，不用排队买票了，而且也省了几十块钱，刷身份证直接可以进去了，不用取票的，推荐大家网络购票
三孔景区,2019/5/11,4,"孔府孔庙是非常的值得一看的  体验下中国儒家文化的博大精深   孔林风景不错   就是孔家墓园   进去不到一小时出来了    本以为地方最大  景点很多  特地买了电瓶车票   结果就是兜一圈去孔子墓 出来坐车出去了   孔子墓距离门口很近   走过去五分钟左右   感觉去不去没必要    以下是重点  景点附近的店铺很坑  石头五元一个刻章别信  因为刻字很贵 10元一个起  我是在孔庙出口就是左转去孔府的出口对门那家刻的   参观完后来见到济宁朋友还告诉我石头是用腊做的   遇热就会变   我也不敢试啊   就像我买的书签上的一句话是这样写的   君子喻于义  小人喻于利   总之买纪念品的话    不要在出口就买   走出100米左右  价格直降一半以上     希望下次能少一个被坑的   真心影响心情     以此为鉴
                            
	                            
		                            "
曲阜三孔,2019/5/10,1分 不佳,不好，别来。真的是名声在外，所有东西都是破破烂烂的。
三孔景区,2019/5/10,4,"济南开车到曲阜2小时
到了门口停车超级坑人
20元一辆车 专坑外地人呢

景区门票三孔连票140元
导游讲解200元

景区很有意义很值得一看
百年圆柏树郁郁葱葱 

就是导游很坑 一路带你在里边买东西 
还把我们带到后门非让我坐马车 一人十元

建议景区好好管理下这些导游
                            
	                            
		                            "
曲阜三孔,2019/5/8,1分 不佳,仅此一次，不会再去了，几个词形容，混乱，昂贵，到处卖东西的，连各个宫殿里面都是卖东西的，而且收这么高门票，居然到处破破烂烂的，只为挣钱，体验极差
三孔景区,2019/5/7,3,"三孔景区是区府里面的旅游场景之一，可能也算是唯一吧来曲阜玩的人，也就是来三孔景区了，这个三孔景区就是孔庙，孔府和孔林的一个缩写统称，把这孔府孔庙孔林三个都叫到一起，就是三孔景区了。如果你打算看两个景区，或者是三个景区都看的话，那就购买三孔景区的通票，因为通票是，140元人民币。比单独买两个景区的价格要划算一下。

另外，教师是免费的，记得提前看一下，这里需要带着教师资格证，还有教师的级别证书过来，比其他的景点多，要了一个证书。
                            
	                            
		                            "
三孔景区,2019/5/7,4,"趁着节假日，赶紧安排出去散散心…山东的朋友邀请了我们好几次，这次就安排山东了…说到山东就会想到孔子…那么这次就去了跟孔子有关的孔庙，孔府，孔林…去孔庙的时候刚好看到有小学生在行拜师礼，这种浓厚的师德文化深深得震撼了我…真是一次孔子文化的洗礼之旅…值得去…
                            
	                            
		                            "
三孔景区,2019/5/7,5,"五一假期过来的，5.3号的，人没有特别多，正好属于热闹的范畴。直接买的三孔联票140块，个人感觉逛孔府孔庙还是有个导游或者电子导游会比较好，导游大概100一个景点，电子导游30块，在孔林看到一个要价300的导游（已经17点了，17.30就不让进了），简直无良。孔庙还是有很深的底蕴的，觉得自己读书太少了，那些文字的含义都不太清楚。。但是，大家来还真的只是人肉参观，该吵吵的吵吵，该随地扔垃圾的扔垃圾，真不知道到底是带孩子来干啥的，学习精神层面和修养，才会影响一生吧。孔林就是孔家人的墓地，因为时间来不及了我们就坐了游览车，司机一个女的，态度超级恶心，我们都不知道她小声的嘟哝竟然是讲解，还说这都是个人好心才给讲，不给讲也说不到她啥。。那还不如不讲呢，根本听不见，转大点的景点（也就是漂亮些的墓地）的时候也是，停都不停，人家别车都停下来给讲讲的。。这女的真太辣鸡了。曲阜这边有很多三轮车，电动的，价格也便宜，也很方便。还有景点会有青萝卜卖，可以尝尝，我是之前没吃过。over
                            
	                            
		                            "
曲阜三孔,2019/5/5,2分 一般,法定节假日绝对不能去，人太多，景区小，而且开门关门仪式因人多而取消。想请导游，但语音设备不足，景区对此预见不足，与其他5A景区比需改进的地方太多。
曲阜三孔,2019/5/4,1分 不佳,夏天，下午4点入园，暴走，2小时，看完，不建议逛，实在无趣。
三孔景区,2019/5/4,4,孔庙还是很值得一去的 个人觉得孔府和孔林没什么去的必要 清明节去的时候孔府还在翻修 挺多东西都没看到 有点遗憾
三孔景区,2019/5/4,4,"孔庙的早上八点开城仪式感很足，挺有意思，景区售票检票应对假期大客流明显措施不足，电子买票里没有学生票的选项，只能人工，而人工窗口有限。万仞宫墙门口的早点又贵又难吃。大殿里的书挺多，买了几本刚翻看了一点，很有意思。
孔府后花园里的那幅画，无论哪个角度路都冲向你，百里香的花这个季节里开的正旺。
孔林，虽是墓群但上无乌鸦下午毒蛇，植被繁茂，万座坟头没有一丝阴森，随处可见的大喜鹊和满地盛开的幽香兰花，不是墓碑我都想不起来这是墓群了
                            
	                            
		                            "
曲阜三孔,2019/5/3,1分 不佳,买了个联票，去三孔加尼山，结果只去了个孔庙就用不了了。什么玩意！
曲阜三孔,2019/5/2,1分 不佳,景区管理模式有问题，对假期客流没有充分的预估，进口一个，出口竟然也是一个，天呐，上万人都要在一个两米宽的小门出景区，大家可以想象一下！
曲阜三孔,2019/5/2,1分 不佳,我们四点多点到的曲阜，而且说的很明白今天要回濮阳，你们的卖票人员也不给说明三孔景区几点关门，硬是叫我们买联票，我们怎么知道五点半景区就关门了，还以为假期呢关门会很晚，结果就去了一个孔府其他两个就进不去了！白白浪费了四张票几百块，你们这是消费诈骗！
曲阜三孔,2019/5/2,1分 不佳,系统显示码刷了，检票口说刷不上，不让进
曲阜三孔,2019/5/2,1分 不佳,太费时了，网上买完了，还得排队换票，比窗口买票还费时，上当了
三孔景区,2019/5/2,2,"讲真的有辱斯文 没想到圣人家乡也这样了

联系买票只买孔庙就好了 孔府和孔林没必要去

孔庙还有些历史景观 商业氛围还可以接受

到了孔府简直不敢恭维 首先被人为设计到一条商业街 而且是必须经过 进到孔府里全是卖东西的 浪费时间直接穿出

到孔林不要坐30元的大巴车 特别堵不如直接5元一位的三蹦子过去 不过去了发现就是个目墓地 而且还有很多新埋的
                            
	                            
		                            "
三孔景区,2019/5/2,5,"?三孔

山东曲阜的孔庙.孔府.孔林统称为“三孔”
1994年孔庙、孔林、孔府被联合国列入《世界遗产名录》

因为时间来不及 只去了孔庙孔府

孔庙是祭祀孔子的地方 孔府是孔子嫡系子孙居住之地  孔林亦称“至圣林” 是孔子及其家族的专用墓地
                            
	                            
		                            "
曲阜三孔,2019/5/1,1分 不佳,自己是山东人！感觉比河南人黑多了！
曲阜三孔,2019/5/1,1分 不佳,差评 一点都不好 孔府离孔林那么远还需要花钱坐车
三孔景区,2019/5/1,5,王羲之五十八代孙，现场书写姓名作诗
三孔景区,2019/5/1,5,"三孔是曲阜必去！首推为孔庙，是孔子老先生开坛授课之所，里面超级大，一定要请导游讲解！赶在了五一放假第一天，人真的超级多，早上八点有开城仪式，可惜我们没有赶上，据说来的迟的就只能看前面人的后脑勺了，孔庙与孔府相连，比较方便
                            
	                            
		                            "
三孔景区,2019/4/30,5,"公司旅游，刚好曲阜大家都没去过，曲阜最有名的孔府孔庙孔林，买票的时候会有导游过来询问，所以就请了导游姐姐来讲，不过听过之后就全忘了，孔府和孔庙挨着逛的时间长点，孔林坐马车过去了，进去以后又坐电瓶车快速的转了一圈
                            
	                            
		                            "
三孔景区,2019/4/28,5,景区非常大，文化底蕴也非常雄厚，建议用一整天的时间参观。
曲阜三孔,2019/4/27,2分 一般,景区周围被招揽停车的，询问导游服务的包围，孔府孔庙除了正店，都是贩卖字画，百家姓的，感觉很不正规，景区内效果一般。孔林门口周围都是招揽生意的村民，上卫生间还要收费，大跌眼镜，有点失望，
曲阜三孔,2019/4/22,1分 不佳,没什么意思，尤其是孔林，就是孔子祖祖辈辈的墓碑，孔庙孔府破烂不堪，长久失修。标示不清晰，连票140，这么贵的门票，都不能拿点钱出来，好好改善一下环境。
曲阜三孔,2019/4/22,1分 不佳,..........................................................
三孔景区,2019/4/22,2,"对于孔府、孔庙、孔林以前只是在书本上了解过，这次是真的来了。
            是自驾游过来的，开车的话得需要三个小时吧，门票是150一个人，买的是通票，建议大家只去孔府看一下就可以，孔府顾名思义是孔老夫子生活的居所，里面有很多他生活的东西，平时的饮食起居，里面都有涉及到，而孔庙和孔林都是孔家祭奠的地方，里面有孔子还有孔子的学生的灵牌和灵位，所以建议大家去孔庙看一下就可以了。
                            
	                            
		                            "
三孔景区,2019/4/19,5,"曲阜三孔，孔庙、孔府、孔林，其中孔庙是祭祀孔子用的，孔府是孔家族人居住之所，两个景区一墙之隔，玩起来很轻松，所展示的也是孔子文化最精粹的一部分。在**旅行网上买的套票，然后在门口找的人工讲解员，带着孩子们逛了两个多小时，讲解的很仔细，孩子们听的很认真，对儒家文化有更深一步的了解。文化之旅，不虚此行(●°u°●)??」
                            
	                            
		                            "
三孔景区,2019/4/18,5,"中华文化的重要见证，万世师表的家长。
走一圈时间还挺长的，感觉孔庙最好，历史建筑保存完好，规模宏大，元朝以来历代皇帝都高度重视啊。孔府次之，没时间的话孔林可以不去。游览顺序也是同上。
开车自驾可以到游客中心停车，吃饭住宿可以考虑兖州，相隔十几公里，吃饭住宿实惠太多。
                            
	                            
		                            "
